<?xml version="1.0" encoding="UTF-8" standalone="no"?>
<?xml-stylesheet type="text/xsl" href="style.xsl"?>
<!DOCTYPE movies SYSTEM "movies.dtd">
<movies xmlns:xsi="http://www.w3.org/2001/XMLSchema-instance" xsi:schemaLocation="movies.xsd">
    <moviename>
        <title>Uri</title>
        <genre>Thriller</genre>
        <releasedate>2019-01-10</releasedate>
        <releaseyear>2019</releaseyear>
        <language>Hindi</language>
    </moviename>
    <moviename>
        <title>Lootcase</title>
        <genre>Thriller</genre>
        <releasedate>2020-07-31</releasedate>
        <releaseyear>2020</releaseyear>
        <language>English</language>
    </moviename>
        <moviename>
        <title>Pushpa</title>
        <genre>Action</genre>
        <releasedate>2021-12-17</releasedate>
        <releaseyear>2021</releaseyear>
        <language>Tamil</language>
    </moviename>
</movies>